{"scope_summary": "A 400 linear ft, 8 ft high reinforced CMU security wall with a smooth concrete cap around a supply yard.", "is_construction": true, "bom": [{"category": "masonry", "description": "8x8x16 concrete masonry units (CMU)", "quantity": 3600, "unit": "each", "source": "derived", "basis": "400 ft x 8 ft = 3200 sq ft x 1.125 blocks per sq ft"}, {"category": "reinforcement", "description": "#5 rebar, vertical every 32 inches", "quantity": 1200, "unit": "linear_ft", "source": "derived", "basis": "400 ft x 12 / 32 = 150 bars x 8 ft"}, {"category": "masonry", "description": "grout fill for reinforced cells", "quantity": 13, "unit": "cu_yd", "source": "derived", "basis": "150 cells x 8 ft x 0.19 cu ft per block course / 27"}, {"category": "masonry", "description": "smooth concrete cap", "quantity": 400, "unit": "linear_ft", "source": "stated", "basis": "400 linear feet long"}, {"category": "masonry", "description": "mortar", "quantity": 3200, "unit": "sq_ft", "source": "derived", "basis": "400 ft x 8 ft wall area"}], "special_requirements": ["#5 rebar every 32 inches vertically", "solid grout fill for all reinforced cells", "no painting or stucco, raw block finish"], "missing_quantities": []}
